<?xml version="1.0" encoding="UTF-8"?>

<!-- ======================================= -->
<!-- Red Horizon XML - Red Alert: Tesla coil -->
<!-- ======================================= -->

<bldg:StructureData xmlns="http://www.westwood.com/redalert"
	xmlns:bldg="http://www.ultraq.net.nz/redhorizon/units"
	xmlns:xsi="http://www.w3.org/2001/XMLSchema-instance"
	xsi:schemaLocation="http://www.ultraq.net.nz/redhorizon/units ../../../Schema/Units.xsd">

	<bldg:Structure
		ID="TSLA"
		Template="DefaultStructure"
		Armour="heavy"
		Cost="1500"
		Hitpoints="400"
		Points="80"
		Power="-150"
		Prerequisites="WEAP"
		Sight="8"
		TechLevel="7"
		Characteristics="CREWED POWERED SENSORS">
		<bldg:Footprint width="24" height="48"/>
		<bldg:Hardpoint
			ID="TeslaCoilHardpoint">
			<bldg:Offset/>
		</bldg:Hardpoint>
		<bldg:WeaponSlot
			AmmoCapacity="3"
			ReloadRate="8000"
			HardpointsUsed="TeslaCoilHardpoint">
			<bldg:Weapon
				ID="TeslaZap"
				Template="TeslaZap"/>
		</bldg:WeaponSlot>
		<bldg:Portrait
			ID="TeslaCoilIcon"
			Filename="tslaicon.shp"/>
		<bldg:Animation
			ID="TeslaCoilAnim"
			Filename="tsla.shp"
			DamagedStartFrame="10">
			<bldg:DefaultAnim
				StartFrame="0" Angles="1" FramesPerAngle="1"/>
			<bldg:IncludedAnim Usage="FIRING"
				StartFrame="1" Angles="1" FramesPerAngle="9"/>
		</bldg:Animation>
		<bldg:BuildAnimation
			ID="TeslaCoilMakeAnim"
			Filename="tslamake.shp"/>
	</bldg:Structure>

</bldg:StructureData>
