<?xml version="1.0" encoding="UTF-8"?>

<!-- ======================================== -->
<!-- Red Horizon XML - Red Alert: War factory -->
<!-- ======================================== -->

<bldg:StructureData xmlns="http://www.westwood.com/redalert"
	xmlns:bldg="http://www.ultraq.net.nz/redhorizon/units"
	xmlns:xsi="http://www.w3.org/2001/XMLSchema-instance"
	xsi:schemaLocation="http://www.ultraq.net.nz/redhorizon/units ../../../Schema/Units.xsd">

	<bldg:Structure
		ID="WEAP"
		Template="DefaultStructure"
		Armour="light"
		Cost="2000"
		Hitpoints="1000"
		Points="80"
		Power="-30"
		Prerequisites="PROC"
		Sight="4"
		TechLevel="3"
		Characteristics="BIB CAPTURABLE CREWED">
		<bldg:Footprint width="72" height="48"/>
		<bldg:Portrait
			ID="WarFactoryIcon"
			Filename="weapicon.shp"/>
		<bldg:Animation
			ID="WarFactoryAnimBase"
			Filename="weap.shp"
			DamagedStartFrame="1">
			<bldg:DefaultAnim
				StartFrame="0" Angles="1" FramesPerAngle="1"/>
		</bldg:Animation>
		<bldg:Animation
			ID="WarFactoryAnimDoor"
			Filename="weap2.shp"
			DamagedStartFrame="4">
			<bldg:DefaultAnim
				StartFrame="0" Angles="1" FramesPerAngle="1"/>
			<bldg:IncludedAnim Usage="FACTORY_BUILD"
				StartFrame="1" Angles="1" FramesPerAngle="3"/>
		</bldg:Animation>
		<bldg:BuildAnimation
			ID="WarFactoryMakeAnim"
			Filename="weapmake.shp"/>
	</bldg:Structure>

</bldg:StructureData>
