<?xml version="1.0" encoding="UTF-8"?>

<!-- ===================================== -->
<!-- Red Horizon XML - Red Alert: Ore silo -->
<!-- ===================================== -->

<bldg:StructureData xmlns="http://www.westwood.com/redalert"
	xmlns:bldg="http://www.ultraq.net.nz/redhorizon/units"
	xmlns:xsi="http://www.w3.org/2001/XMLSchema-instance"
	xsi:schemaLocation="http://www.ultraq.net.nz/redhorizon/units ../../../Schema/Units.xsd">

	<bldg:Structure
		ID="SILO"
		Template="DefaultStructure"
		Armour="wood"
		Cost="150"
		Hitpoints="300"
		Points="25"
		Power="-10"
		Prerequisites="PROC"
		Sight="4"
		Storage="1500"
		TechLevel="1"
		Characteristics="CAPTURABLE">
		<bldg:Footprint width="24" height="24"/>
		<bldg:Portrait
			ID="SiloIcon"
			Filename="siloicon.shp"/>
		<bldg:Animation
			ID="SiloAnim"
			Filename="silo.shp"
			DamagedStartFrame="5">
			<bldg:DefaultAnim
				StartFrame="0" Angles="1" FramesPerAngle="1"/>
			<bldg:IncludedAnim Usage="SILO_FILL_25%"
				StartFrame="1" Angles="1" FramesPerAngle="1"/>
			<bldg:IncludedAnim Usage="SILO_FILL_50%"
				StartFrame="2" Angles="1" FramesPerAngle="1"/>
			<bldg:IncludedAnim Usage="SILO_FILL_75%"
				StartFrame="3" Angles="1" FramesPerAngle="1"/>
			<bldg:IncludedAnim Usage="SILO_FILL_100%"
				StartFrame="4" Angles="1" FramesPerAngle="1"/>
		</bldg:Animation>
		<bldg:BuildAnimation
			ID="SiloMakeAnim"
			Filename="silomake.shp"/>
	</bldg:Structure>

</bldg:StructureData>
